{
  "assetCaptures": [
    {
      "acquisitionMethod": "local human-authored metadata fixture",
      "assetId": "fc_ast_00000000-0000-4000-8000-000000000001",
      "byteSize": 471,
      "capturedAt": "2026-07-16T20:15:00Z",
      "createdAt": "2026-07-16T20:15:00Z",
      "id": "fc_cap_00000000-0000-4000-8000-000000000001",
      "localPath": "fixtures/pilots/apollo-11-landing/local/touchdown-times.input.json",
      "mimeType": "application/json",
      "sha256": "5cde33cd18b71cfc5b9de8616092bfdde92d9687d24cef166501da424f984f63",
      "softwareVersion": "forensic-crawler-fixture/1.0.0",
      "storageState": "permitted"
    },
    {
      "acquisitionMethod": "deterministic JSON canonicalization",
      "assetId": "fc_ast_00000000-0000-4000-8000-000000000001",
      "byteSize": 471,
      "capturedAt": "2026-07-16T20:15:01Z",
      "createdAt": "2026-07-16T20:15:01Z",
      "id": "fc_cap_00000000-0000-4000-8000-000000000002",
      "localPath": "fixtures/pilots/apollo-11-landing/local/touchdown-times.canonical.json",
      "mimeType": "application/json",
      "sha256": "10d7f00cd8f79952f79ec4aa553a3c79bf7c4f58cb18c2b36d60082837257e54",
      "softwareVersion": "forensic-crawler-canonical-json/1.0.0",
      "storageState": "permitted"
    }
  ],
  "assetSourceRelationships": [
    {
      "assetId": "fc_ast_00000000-0000-4000-8000-000000000001",
      "createdAt": "2026-07-16T20:15:00Z",
      "function": "derives_from",
      "id": "fc_asrel_00000000-0000-4000-8000-000000000001",
      "locator": {
        "kind": "section",
        "label": "Source value 102:45:39.9",
        "value": "5.4 Landing Dynamics"
      },
      "sourceId": "fc_src_00000000-0000-4000-8000-000000000001"
    },
    {
      "assetId": "fc_ast_00000000-0000-4000-8000-000000000001",
      "createdAt": "2026-07-16T20:15:00Z",
      "function": "derives_from",
      "id": "fc_asrel_00000000-0000-4000-8000-000000000002",
      "locator": {
        "kind": "row",
        "label": "Source value 102:45:43",
        "value": "Lunar Landing Time"
      },
      "sourceId": "fc_src_00000000-0000-4000-8000-000000000002"
    }
  ],
  "assetTransformations": [
    {
      "assetId": "fc_ast_00000000-0000-4000-8000-000000000001",
      "command": "deterministic-local-builder",
      "configurationHash": "c1b600fd2487300f53e74bffcc12b429225eff69a0ba28c09e9f054d1e13e210",
      "createdAt": "2026-07-16T20:15:01Z",
      "environment": {
        "network": false,
        "rawThirdPartyBodies": false
      },
      "id": "fc_xfm_00000000-0000-4000-8000-000000000001",
      "inputCaptureId": "fc_cap_00000000-0000-4000-8000-000000000001",
      "method": "sort object keys and ID-bearing arrays; preserve numeric values",
      "operator": "local deterministic tool design",
      "outputCaptureId": "fc_cap_00000000-0000-4000-8000-000000000002",
      "parameters": {
        "indentSpaces": 2,
        "trailingNewline": true
      },
      "softwareVersion": "forensic-crawler-canonical-json/1.0.0"
    }
  ],
  "assets": [
    {
      "createdAt": "2026-07-16T20:15:00Z",
      "id": "fc_ast_00000000-0000-4000-8000-000000000001",
      "investigationId": "fc_inv_00000000-0000-4000-8000-000000000001",
      "mediaType": "dataset",
      "rightsDecisionId": "fc_rgt_00000000-0000-4000-8000-000000000004",
      "sourceIds": [
        "fc_src_00000000-0000-4000-8000-000000000001",
        "fc_src_00000000-0000-4000-8000-000000000002"
      ],
      "title": "Locally authored touchdown-time comparison"
    }
  ],
  "auditEvents": [
    {
      "actorId": "source-reconciliation-editor",
      "actorIdentity": {
        "authenticated": false,
        "displayName": "source-reconciliation-editor",
        "identityType": "human_role",
        "serviceVersion": null
      },
      "actorType": "human_role",
      "createdAt": "2026-07-16T20:00:00.000Z",
      "details": {
        "networkUse": "manual research only",
        "rawBytesRetained": false
      },
      "eventHash": "1961f472eb756142cdf3b24b38a98b6afb090e1905bc9d72e5083689ab1dfbbe",
      "eventType": "source_scope_reviewed",
      "id": "fc_aud_00000000-0000-4000-8000-000000000001",
      "investigationId": "fc_inv_00000000-0000-4000-8000-000000000001",
      "occurredAt": "2026-07-16T20:00:00.000Z",
      "previousHash": null,
      "sequence": 1,
      "subjectIds": [
        "fc_src_00000000-0000-4000-8000-000000000001",
        "fc_src_00000000-0000-4000-8000-000000000002",
        "fc_src_00000000-0000-4000-8000-000000000003"
      ]
    },
    {
      "actorId": "forensic-crawler-fixture/1.0.0",
      "actorIdentity": {
        "authenticated": false,
        "displayName": "forensic-crawler-fixture/1.0.0",
        "identityType": "local_tool",
        "serviceVersion": "forensic-crawler-fixture/1.0.0"
      },
      "actorType": "local_tool",
      "createdAt": "2026-07-16T20:18:00.000Z",
      "details": {
        "differenceSeconds": 3.1,
        "sourceBodiesCopied": false
      },
      "eventHash": "4092ecfbcdf93c632f239cab10f16e60dd89ca34147992af8e535fdd75d38e02",
      "eventType": "metadata_fixture_created",
      "id": "fc_aud_00000000-0000-4000-8000-000000000002",
      "investigationId": "fc_inv_00000000-0000-4000-8000-000000000001",
      "occurredAt": "2026-07-16T20:18:00.000Z",
      "previousHash": "1961f472eb756142cdf3b24b38a98b6afb090e1905bc9d72e5083689ab1dfbbe",
      "sequence": 2,
      "subjectIds": [
        "fc_ast_00000000-0000-4000-8000-000000000001",
        "fc_cap_00000000-0000-4000-8000-000000000001",
        "fc_cap_00000000-0000-4000-8000-000000000002",
        "fc_xfm_00000000-0000-4000-8000-000000000001"
      ]
    },
    {
      "actorId": "temporal-reconstruction-analyst",
      "actorIdentity": {
        "authenticated": false,
        "displayName": "temporal-reconstruction-analyst",
        "identityType": "human_role",
        "serviceVersion": null
      },
      "actorType": "human_role",
      "createdAt": "2026-07-16T20:26:00.000Z",
      "details": {
        "differenceSeconds": 3.1,
        "preferredExactTime": null
      },
      "eventHash": "0f202eb404062cf4424bfbd7137c1a9bcd40dd3b0bdb2bd264e112d28122d07b",
      "eventType": "temporal_discrepancy_recorded",
      "id": "fc_aud_00000000-0000-4000-8000-000000000003",
      "investigationId": "fc_inv_00000000-0000-4000-8000-000000000001",
      "occurredAt": "2026-07-16T20:26:00.000Z",
      "previousHash": "4092ecfbcdf93c632f239cab10f16e60dd89ca34147992af8e535fdd75d38e02",
      "sequence": 3,
      "subjectIds": [
        "fc_ctr_00000000-0000-4000-8000-000000000001",
        "fc_tmp_00000000-0000-4000-8000-000000000001",
        "fc_tmp_00000000-0000-4000-8000-000000000002"
      ]
    },
    {
      "actorId": "rights-privacy-compliance-editor",
      "actorIdentity": {
        "authenticated": false,
        "displayName": "rights-privacy-compliance-editor",
        "identityType": "human_role",
        "serviceVersion": null
      },
      "actorType": "human_role",
      "createdAt": "2026-07-16T20:29:00.000Z",
      "details": {
        "exportProfile": "private_workspace",
        "remoteBytesRetained": false
      },
      "eventHash": "a85d0d2e81157f0d7578692d6f6dbeb315fed4f93f52b857b9376b07e51766c5",
      "eventType": "rights_review_recorded",
      "id": "fc_aud_00000000-0000-4000-8000-000000000004",
      "investigationId": "fc_inv_00000000-0000-4000-8000-000000000001",
      "occurredAt": "2026-07-16T20:29:00.000Z",
      "previousHash": "0f202eb404062cf4424bfbd7137c1a9bcd40dd3b0bdb2bd264e112d28122d07b",
      "sequence": 4,
      "subjectIds": [
        "fc_rev_00000000-0000-4000-8000-000000000001",
        "fc_rgt_00000000-0000-4000-8000-000000000001",
        "fc_rgt_00000000-0000-4000-8000-000000000002",
        "fc_rgt_00000000-0000-4000-8000-000000000003",
        "fc_rgt_00000000-0000-4000-8000-000000000004"
      ]
    },
    {
      "actorId": "forensic-crawler-package/1.0.0",
      "actorIdentity": {
        "authenticated": false,
        "displayName": "forensic-crawler-package/1.0.0",
        "identityType": "local_tool",
        "serviceVersion": "forensic-crawler-package/1.0.0"
      },
      "actorType": "local_tool",
      "createdAt": "2026-07-16T20:42:00.000Z",
      "details": {
        "schemaVersion": "1.0.0",
        "status": "working"
      },
      "eventHash": "b24490299598bf550ea3b1a64e168d9e2d9f60da96741b4fa44ab637207f4b00",
      "eventType": "working_package_assembled",
      "id": "fc_aud_00000000-0000-4000-8000-000000000005",
      "investigationId": "fc_inv_00000000-0000-4000-8000-000000000001",
      "occurredAt": "2026-07-16T20:42:00.000Z",
      "previousHash": "a85d0d2e81157f0d7578692d6f6dbeb315fed4f93f52b857b9376b07e51766c5",
      "sequence": 5,
      "subjectIds": [
        "fc_pkg_b3f890b4-9a89-45b8-8101-35e42297bfe6",
        "fc_inv_00000000-0000-4000-8000-000000000001"
      ]
    }
  ],
  "claimRevisions": [
    {
      "changeReason": "Initial normalized synthesis with discrepancy preserved.",
      "claimId": "fc_clm_00000000-0000-4000-8000-000000000001",
      "claimant": "Forensic Crawler working analysis",
      "createdAt": "2026-07-16T20:10:00Z",
      "id": "fc_clmr_00000000-0000-4000-8000-000000000001",
      "revisionNumber": 1,
      "text": "Two official NASA records report that Eagle landed on the lunar surface; their exact recorded mission elapsed times differ by 3.1 seconds."
    },
    {
      "changeReason": "Initial source claim transcription.",
      "claimId": "fc_clm_00000000-0000-4000-8000-000000000002",
      "claimant": "Apollo 11 Mission Report",
      "createdAt": "2026-07-16T20:10:00Z",
      "id": "fc_clmr_00000000-0000-4000-8000-000000000002",
      "revisionNumber": 1,
      "text": "The Apollo 11 Mission Report records landing on the surface at mission elapsed time 102:45:39.9."
    },
    {
      "changeReason": "Initial source claim transcription.",